{
  "laneId": "authority-artifact-write.v1",
  "laneType": "github:authority-artifact-write",
  "providerAlias": "github",
  "surfacePattern": "evyverse-authority/artifacts/*",
  "bootstrapable": false,
  "receipt": {
    "kind": "github-pull-request",
    "repository": "evytheodoruas/evyverse-authority",
    "workflow": "aos-authority-artifact-write",
    "grantRef": "grants/authority-artifact-write.v1.json",
    "grantIssuedBy": "root-authority",
    "records": [
      "provider record requesting the artifact write",
      "signed authority-artifact-write grant reference",
      "artifact branch",
      "artifact PR URL",
      "aos-semantic-verifiers check result",
      "sigstore bundle for the artifact",
      "published commit sha"
    ]
  },
  "readback": {
    "commands": [
      "gh api repos/evytheodoruas/evyverse-authority/actions/runs/<run_id>",
      "gh api repos/evytheodoruas/evyverse-authority/contents/grants/authority-artifact-write.v1.json?ref=main",
      "gh pr view <artifact_pr> --repo evytheodoruas/evyverse-authority --json autoMergeRequest,mergeStateStatus,statusCheckRollup,mergedAt",
      "gh api repos/evytheodoruas/evyverse-authority/contents/<artifact_path>?ref=main",
      "cosign verify-blob --bundle <artifact>.sigstore.json <artifact>"
    ],
    "mustShow": [
      "signed authority-artifact-write grant is present on the protected authority ref",
      "artifact PR was verifier-gated and merged by provider auto-merge",
      "artifact and sigstore bundle exist on the authority ref",
      "bundle identity matches the authority-artifact workflow"
    ]
  },
  "redaction": {
    "publicRepository": true,
    "rules": [
      "authority artifacts are public by design",
      "artifact payloads must contain no raw credentials, private keys, tokens, cookies, refresh token values, or personal secrets",
      "provider records may link to private context but may not embed private material"
    ],
    "denyPatterns": [
      "gh[pousr]_[A-Za-z0-9_]{20,}",
      "github_pat_[A-Za-z0-9_]+",
      "-----BEGIN .*PRIVATE KEY-----",
      "AKIA[0-9A-Z]{16}",
      "password\\s*[:=]",
      "secret\\s*[:=]",
      "token\\s*[:=]"
    ]
  },
  "recovery": {
    "posture": "revert-artifact",
    "command": "publish a signed revert artifact through the same authority-artifact workflow; never rewrite protected history"
  }
}
